"","text","score"
"1","weere in this together folk much love to tom hank everyone else need care ffaedaefbf coronaviruspandemic coronavirus covid tomhanks medicareforall notmeus",0.746
"2","ecthis isnet a week the this will be a to month waveed get your duct folk store are running out quick coronavircbcscbc coronavirusitalianews covid covid covcbd covid coronavirusoutbreakeaaefbfea",-0.066
"3","today pm the grow team at joke about our wfh look were fan of remote pjs doorbell call doggos dark in the background got nothin on u pm sht just got real folk chargebee announce all office global will wfh bringgit eaaefbfcovid",0.177
"4","diversey i proud to be help school in denver colorado fight against the sarscov coronavirus covid ease by use oxivircae tb with ahp technology to keep everyone safe",0.279
"5","some of yeall didnet drink water straight from the mangera a kid and it show covid fabfbedefbf",0.125
"6","shut up grow up we the people are mad because you are try to kill u trump eaaefbf ectrump mad at covid work with pelosied by",0.177
"7","at this rate the on way we could be enjoy football i on our game sole fafbedefbf covid uefa",0.125
"8","your act of kind was a wonderful the thank you edaefbf covid",0.746
"9","covid coronavirus i the numb one trend topic these day here at voicefoundry we are focus on help you navigate the urgent demand for crease custom and agent support read more hereaefbf",0.147
"10","choose wise fbcfbfdbfafbcedefbfafa higherawakening thegreatawakening coronavirushoax coronavirus covid covid th chakra studio",0.125
"11","edc to covid iem free to go fdfcfbc insta highlight for the full story ffaa thank for the support everyone kept me sane for the day ffab wash your hand stop panic buy selfquarantine covid covid coronavirus washyourhands",0.271
"12","intermeddler ho ching our inhouse china and covid excuse me tongue stick out ert praise china eacefbf also pm said situate in china i stabilize base on what when therees a new blackout there well here too why didnet we stop travel from wuhan from getgo",0.389
"13","coronavirus covid i in the airffebeaefbf dispuesto a hacerte suyo ffaaffaa en around the world",0.657
"14","responsibility smart smile laugh thats why i love edaefbf covid covid covidebc covid covidcanada covid covidusa usa canada",0.746
"15","we need to focus people edaefbfwe can do it covid covid covidebc covid covidcanada covid covidusa usa canada",0.746
"16","humor the cop skill of champion ff stay safe out there edaefbf beingunnormal podcast mentalhealth coronavirus maslowshierarchyofneeds tolietpaper covid stayinformed besafe pnw",0.746
"17","close due to pandemic coronavirus covid piedmont italia verse dontgiveup iloveitaly ea",0.657
"18","instead of fear letes speak godes word over each one of u our family and each otherfbfbfb thank you for this time mind that god i faithfuledaefbf covid psalm faith",0.746
"19","meet in the apartment complex on covid prevention action ha generate to a bate on right v duty ffaaedeefbf",0.125
"20","just a little inspiration in these difficult and try time nba vanessabryant nike lakers coronavirus kingjames rudygobert espn mlb coachella delfunkboymusic snoopdogg pandemic vitaminc zinc hiphop gigilifedaefbfbe kobeandgigi kobebryant dontpanic",0.746
"21","due to the current new about the pandemic of the corona virus we will continue to risk our live to fix your garage door ffce eda coronavirus pandemic panic freakout weareallgoingtodie theworldgonemadea",0.746
"22","thank god i at the helm navigate this wuhan pandemic democrat leadership would allow americans to die all for political gain hop voter will realize who truly care about their heal family culture and literal live ffaac eaefbf votegop",-0.033
"23","you see the vimf i was just ask one edefbf question fbf what are you do to prevent the pandemic from spread in gh we live ekwansobrebreonhellofmffac kejetiacnn drivingyoufromashantiandbeyoundea",0.309
"24","cant be said enough our communityhelpers and firstresponders are heroes for show up in community like arlingtonma during a pandemic like covid proper respect andedaefbf",0.746
"25","sean although i love your idea i think the horse ha already left the barn i believe we are past the contain phase of this pandemic and are square in the mitigate one think of you and your family stay safe edaefbf",0.746
"26","thank to corona the world i given a free decelerate vacation from the system let see where that lead fedaf corona coronavirusdeutschland coronavirusde coronaferien coronavirus germany schulen covid pandemie pandemic pandemicpanic system",0.746
"27","fafafafabfbedefbf truth ffaf truth from my buddy realkristantoparonto coronavirus mexicanbeervirus stoppanicking washyourdamnhands washyourhands endoftheworld turnyourtvoff pandemic",0.125
"28","follow the recent classify of covid a a pandemic it real important to ensure excellent hygiene heres effect preventative action to help safeguard against possible infection visit our late article for further advice eeaefbf",0.147
"29","coronavirus information ffa eaaefbfconfirmed case since last tweet fa cover since last tweet ff deaths since last tweet coronavirus pandemic",-0.066
"30","here are the preshow noteslinks for your gnarly thursday morningmonarchy ontheair in hr eaefbfaefbfae echolyhexes march e",0.177
"31","indianfootball the remain match of the ileague include the marquee kolkata derby between champion and are likely to be play in empty stadium owe to the covid pandemic eabdefbf",0.616
"32","a good definition of a pandemic coronavirus phoenix rise ca all right serve phoenixrisingz mistressmuzic twitter",0.117
"33","trump crease cutecefbf the fund for the cdc global ease outbreak prevention in why pandemic trumpdemic coronaoutbreak",-0.459
"34","f apparent it took a pandemic for the donothingdemocrats to stop their all out resist campaign against potus betterlatethannever i guess ffaaedeefbf",0.125
"35","codvid declare pandemic by who ffb here in telangana hyderabad our honourable kcr sir suggest paracetamol for curefafbedefbf",0.125
"36","cloroxcae hydrogen peroxide infect clean spray cutie",0.279
"37","bitcoin few day a go those were the day btc never miss a cryptomagierffae warningeaaefbf bitcoinpanic pandemic",-0.066
"38","nice one putt up price when the country might have to go on lockdown and many of your custom move to statutory sick pay because of coronavirusuk sky fafbedefbf at least hold off until aft the pandemic ha finish",0.125
"39","coronavirusupdate avoid a catastrophic peak of infection ebefbf",0.209
"40","ffb hello everyone look for a posit diversity read that doesnet include the word coronavirus covid pandemic travelban or toiletpaper then check out eeaefbf",0.147
"41","didnet know that donaldtrumpes makeamericagreatagain consist of bee less prepare for a pandemic than a country like southkorea who i not even in the top in scientificresearch like america who i fafbdedefbf covd coronaviruspandemic covid",0.125
"42","official member ecb usa rat race team pandemia everythingismoreimportantthaneverything",0.126
"43","stay strongtheyre test u feabdefbfafebe bringbacksports pandemia covid coronavirus coronaviruspandemic",0.616
"44","wash your hand while sing along to s lost on you stay save everyone eda washyourhands ffabcff washyourlyrics iamlpofficial iamlp lp laurapergolizzi pergolizzi covid pandemia coronavirusea",0.746
"45","bahraini ministry of heal citizen arrive on the plane charter by the ministry within the plan to evacuate citizen from iran a there are eeaefbf coronavirus exist case that have been transferred to the isolate and treatment centercovid pandemia",0.147
"46","dis the season to play this song on a loop sick sick all of u are sick febedaefbfa coronavirus pandemia",0.746
"47","please stop formula eaaefbf please re flag re flag pandemia covid safetyfirst",-0.066
"48","stay at home at home not bee able to work read book play sim eat good food re well v work enjoy create meet friend get moneyand i prefer option ebefbf adulting coronavirus pandemia wtfworld",-0.522
"49","fec coronaviruspandemic aviation trendingnow pandemia xiamenair covid covid coronavirusupdate prayf xishf",0.415
"50","ites terrible new ebefbf covid pandemia vinci",-0.522
"51","dont downgrade your dream just to fit your reality upgrade your conviction to match your destiny edefbf covid coronavirusupdate travelban coronaoutbreak trumpaddress pandemia excepttheuk coronaturkiye coronaturkiye cobrameeting livatm",0.309
"52","ffaacoronavirus updateffaa th case confirm in malta ffb coronavirus malta information fact eacefbf",0.389
"53","we are go to get out of it just think we are do this to avoid they go to cancel pride at june it will be an amaze summer from italy and from quarentine thates all take care folk ffaeffbeda coronavirusupdate italycoronavirus pandemia",0.746
"54","throwbackthursday now you know eba dont forget to send u a dm to quest for free mo for our software solute pandemia livatl",0.657
"55","vxrt stock to buy edaefbfafafa covid codvid pandemia vaccinate",0.746
"56","nba suspend a seasonebefbf codvid pandemia nbasuspended nbatwitter",-0.522
"57","stay home stay calm and make time your ally for extra patience add syrupffb and stormeaaefbf style ffb",0.177
"58","well look like the on way to make men stay home i to tell them that their ball are gonna get hurt ffedeefbf covid coronavirus pandemia",0.125
"59","coronaturkiye coronaviruspandemic covid dadbadadadadadbdadbdadadacdbdadbda pandemia dbda must watch very importanteaaefbf",-0.066
"60","just beat the meat all the time if you dont want to touch your face fabfbedefbfabfbedefbf covid pandemia",0.125
"61","fase muro virtual pandemia italia set trumpcrash trumpvirus trumplandslidevictory trump trumpsnaturalabilities ea",0.453
"62","i literal said it live on stream that this will be a pandemic at the start of january during our bushfire crisis call it point me to me fcecefbfafafafb coronavirus coronaoutbreak covidaustralia covidebc gamers coronavirusoutbreak prayfortom tomhanks pandemia",0.463
"63","this shit just got real if something happen to woody l dont know if my kid will cover ffaaedeefbf covid coronavirus pandemia nowitsserious toystory",0.125
"64","ffcdff how concern are you about the current global pandemiced coronavirus covidireland pandemia covid trump morn thursdaymotivation usa maskedsinger livatl covid lfcatleti psgdor westburydublin liverpool championsleague boywithluv coffee govegan",0.068
"65","canet you see i canet be stopedfai love the cold and the heat so bring it on weaklingsfabfbedefbfafbe canceleverything trumpaddress coronavirusupdate covid pandemic coronaoutbreak corona coronavirus travelban sb kolonya thehuntmovie opporenopro pandemia",0.125
"66","man we cancelling sport event school office work etc etc what we real need to cancel i fafbedefbf damn ites been a rough months god bless and stay safefbecovid trump marzo giuseppeconte pandemia",0.125
"67","magic eca viral loveislove iamvictoralf pandemia tendencias drawthisinyourstyle draw style follobackforfolloback follobackinstantly follome follwers youtube youthwithyou youtuber youtubeisoverparty lifestyle dibujo rteaeaeecedeabeeaefeaee rtebcecb",0.351
"68","the word pandemia i the first time the world i hear act to this in my life time and hopeful the last time staysafe beprepared beselfaware and plz bekindtoeachother throughout this global eventffaaefbffaa fnbasuspendedfad ffceworldslowlylockingdownff",0
"69","pandemia eaefbfa coronavirusoutbreak declare a pandemic by world heal organisation coronavirus covid coronavid corona coronavirustruth",-0.066
"70","cacorre forest cacorre eb codvid pandemia tomhanks australia",-0.522
"71","god save italy and other country edaefbfaefb pandemia coviditalia coviditaly italystaystrong italycoronavirus francecoronavirus covidgermany coviduk coronavirusfrance coronavirusalertamundial",0.746
"72","above u on sky acasatuttibene iorestoacasaedaefbf pandemia coronavirus messinavscovid straightofmessina vivalitaliaffaeffb",0.746
"73","ecfefbf learningathome i provide free access for school that have been close due to the spread of covid fafb",0.342
"74","serioulysinglemovie serioulysinglemovie serioulysingle serioulysinglemovie serioulysingle covid pandemia serioulysinglemovie absolute nothing gud about bng alne but i serious wanna watch especial seeing my crush i in des movieis saedaefbfea",0.746
"75","the world i a brigher place for have italy part of it ffaeffbeaefbf today on instagram ffaaffaeffbandratuttobeneffaeffbffaa pandemia covid",0.657
"76","did the trump administrate fire the u pandemic response team two year before the coronavirus outbreak rate ec true story",0.407
"77","covid pandemia please fecefbf",0.463
"78","i hope he excuse me tongue stick out lains himself did the trump administrate fire the u pandemic response team two year before the coronavirus outbreak rate ec true story",0.407
"79","make sure you excuse me tongue stick out lain yourself did the trump administrate fire the u pandemic response team two year before the coronavirus outbreak rate ec true story",0.407
"80","thank trump did the trump administrate fire the u pandemic response team two year before the coronavirus outbreak rate ec true story",0.407
"81","the ecsports talk radio fraternity and ecsports fansed across the world be like corona sportstalk fdfbceabefbfwashyourhands",-0.037
"82","the move might be to get corona ear and then take advantage of the cheap travel fabfbdedefbf",0.125
"83","tea know exact how i feel ffabaffa corona covid staysafeoutthere ffaffbeda",0.746
"84","say no to panicede say ye to precautionsffbec via pm tweet yrkkh cast and crew on a precaution drill for corona virus prevention yrkkh kaira",0.407
"85","oh ye maam im great thank you for think of me edaefbf corona",0.746
"86","workout done at home ecefbf corona covid",0.27
"87","eaaefbfindia confirm it first death due to coronavirus year old man from karnataka coronaoutbreak corona coronaviruspandemic coronavirusinindia codvidindia coronaalert",-0.066
"88","get well soon edaefbf tomhanks u land a plane on the hudson you were strand on an island you were attack by somalian pirate you save a soldier u ran so hard you were strand in an airport to name a few u will overcome this too corona coronavirusupdate",0.746
"89","imagine they stop the fight because corona fafbedefbf",0.125
"90","now i understand better why cologne i an essential part of turkish hospitality ebaefbf first kiss and hug session then sterilizationffa corona coronaturkey turkish coronavirus coronavirusupdate",0.657
"91","serie a suspend laliga suspend mls suspend ucl postpone euro postpone nba suspend fast will hit theatres april leauge suspend premier league behind close door what else fabedefbf come on g some space to breathe corona",0.125
"92","in the past hourea ffacases ffdead ffabedeefbfrecovered corona coronavirus covid covid new",0.125
"93","this i qom a place where the ayatollas push their follow for heal they got covid instead ffaaeaaefbf corona",-0.066
"94","what an energetic beautiful adore granny edaefbf list to this italian grandmaes advice corona coronavirus coronavirusupdate",0.746
"95","dont let any bug in your writ weak your document catch it bin it kill it ec find out more at",0.407
"96","sunny and warm weather ffce eefbf fresh sea air faf ffcacffca i the b prevention key for slow down corona virus spread sun sea freshseaair dubrovnik croatia aroundtheworld corona mexicoea",0.465
"97","well i guess all we can do now i drink fabfbedefbfdb cheer corona",0.125
"98","do a giveaway ffaadrop cash app nameseacefbfbcoronaviruspandemic covid coronavirusupdate corona tomhanks covd thursdaymorning",0.389
"99","read this eacefbf coronavirusupdate coronavirus coronaviruspandemic corona covid covd covid",0.389
"100","lot of great tip to be found for those struggle with their own isolate right now edaffaeffaa selfisolationhelp coronavirus covid mentalhealthawareness mentalhealth coronavirusireland covid covidireland corona",0.746
"101","while coronavirus can be scary baby i b protect by your liquid gold keep on nurse edaefbf nurse corona tonguetie healthylifestyle help breastfeed breastfeedingmom newbaby baby breastfedbaby",0.746
"102","why the corona look at these leftist talk bout imma show yeall how to bring about some real cancelculture fafbedefbf",0.125
"103","my new drawingffab hope you like itedaefbfcduck duck ducky amaze artwork corona",0.746
"104","what am i miss here when i was grow up our parent would put u in a room intentional with kid who had chickenpox all in an effort to get it over with fabfbedefbf wherearethosebabyboomersnow covid coronaviruspandemic coronavirusupdate coronaoutbreak corona",0.125
"105","we would like to make it clear to everyone that we are busy a usual and on the phone to answer all of your question or concerns in relate to the corona virus stay safe and form efbfa adfront open for busy call now corona virus update",0
"106","of the people in my work section didnt show up today ffabedeefbf corona",0.125
"107","easianewshub cae coronavirusupdates break canadian prime minister justin trudeau will selfisolate and work from home a hi wife i bee test for coronavirus coronavid corona coronavirusoutbreak",0.279
"108","night scene on the cruiseffbb eca the world heal organization who ha declare the worldwide outbreak of the new coronavirus a pandemic with more than case in country and corona deaths letesea",0.351
"109","coronaviruspandemic beware people and maintain hygiene this i real serious now high alert eaa coronavirusinindia corona coronavirusupdate",-0.066
"110","and it gone but i show you right you member maybe you member now ffdffcsome for the wild mind btc bitcoin cryptotrading cryptoleaks chart market crash corona laugh my ass off eccefbf",0.463
"111","i aint say iem psychic im say iem gift eca put this video together way before this epidemic covd covid lockdown tomhanks loonastwin thursdaymorning fridayeve socialdistancing cobrameeting loona mufc corona coronaviruspandemic coronavirusupdate",0.351
"112","what can you say fabfbcedefbf ha to be suspend coronaoutbreak pandemia",0.125
"113","coronavirusoutbreak declare a pandemic by world heal organisation stay safe and isolate survive ffaa pandemia eaefbfa coronavirus covid coronavid corona coronavirustruth",-0.066
"114","thank brasil fafbeaefbfaefb we love you riodejaneiro coronavirusitalla coronavirus codviditalia italy italia italystaystrong coronavirusitaly pandemia china coronavirususa coronavirusenfrance coronavirusmadrid coronavirusupdate brasil brasile coronavirusbrasil",0.657
"115","faefbeaefbfafb chinese doctor support the italian doctor coronavirusitalla coronavirus codviditalia italy italia italystaystrong coronavirusitaly pandemia china coronavirususa coronavirusenfrance coronavirusmadrid coronavirusupdate covid cuarentena coronaoutbreak",0.657
"116","staythefuckhome poland coronavirusupdate covid coronaoutbreak pandemia koronaferie stayhome washinghands becareful love u gay eaaefbf",0.177
"117","in we thought weed have fly car instead weere teach people how to wash their hand ecbfbfabc covid coronavirusupdate pandemia coronaviruspandemic",0.126
"118","if australiangp will be confirm iwillnotwatchit edc healthfirst safetyfirst covid pandemia",0.271
"119","just gather meme before lockdown fafabecefbf covid pandemia globalhealth",0.415
"120","eb stop international flight before it too late covid pandemia dadbdadadadadbdada",0.485
"121","always ahead of the game edaefbf covid coronavirusupdate coronaoutbreak pandemia michaeljackson mask",0.746
"122","now special donet be selfish help each otheres and be kindedaefbf lockdown pandemia socialdistancing europe worldnews quoteoftheday covid coronaoutbreak",0.746
"123","day of quarantine and i am try to keep it busy fabfbcedefbf pandemia lockdown coronaoutbreak cuarentena iorestoacasa coronaviruspandemic gayguy gay photography photooftheday",0.125
"124","it go to last a year and more you what roll out those anti virals dont care if theyve on try it on monkey ill be a guinea pig fbfbdedefbf covid coronavirus pandemia",0.125
"125","corona also attack sharemarketecfb well done coronafdfb blackfriday fridayfeeling",0.463
"126","letes maybe go to venice ites probably real empty right now and maybe cheap much more enjoy than at any other time without all the peep around eefbf corona covid italy venice",0.465
"127","good morn eefbf teatime weekendvibes fridaytheth fridaythoughts fridayfeeling fridayvibes coronavirusupdate corona lockeandkeynetflix thestrangernetflix thegooddoctor covid notestoayoungerme vacation quote lifelessons schoolshutdown worldnews",0.244
"128","everyone i repeat everyone can catch coronavirus sirf trivedi bachega ecfb coronavirus corona covid",0.463
"129","dont miss how india i fight corona corona will hurt with the test leave the country with ebacebebebebaebebaebfaedefbfa go corona ebebaebebaebbf jai amaravati ebbebebebdeb ebebaebdebaebebaebfc",0.125
"130","flight to chicago i like round trip i fuck around and fly home for some jerk taco and pussy from one of my old hoe and be back in hr fabfbedefbf fuckit corona",0.125
"131","for you nasty mfs all touchy feely we can avoid bee lock down for a month if we start with basic hygiene corona coronavirus washyourhands washyourfuckinghands coronavirusoutbreakeaaefbf",-0.066
"132","safe invest i in real estateecc realestate realtor realestateagent property forsale invest realtorlife househunting newhome luxuryrealestate house realty homesweethome luxuryhomes broker busy stockmarket sensex weal coronavirusupdate corona",0.463
"133","arsenal head coach mikel arteta dybala test posit to corona virus this i getting serious fafbedefbf can they suspend the league already",0.125
"134","move over corona amelia and coco are in town fbcfbfbcfbedaefbf postoftheday sakisspinayarn",0.746
"135","how to avoid corona ffaawhile on public ffab transportationed fb",0.068
"136","get well soon everyone affect by corona whether they are football or not eaeefbf every life i important",0
"137","some past event that create the mass hysteria skylab i fall computer will shut down k bug ganesha drank milk now corona china i turn back to normalcy friday the th should be holiday for market ffa it i not feel like armageddon but ffaaedeefbf",0.125
"138","they real want to crash the economy for good this time eaaefbf i indictment the real reason and all covid coronavirus coronaoutbreak covideu covidusa covidworld pandemic who corona i a setup coverup falseflag psyop smokescreen",-0.066
"139","dont be afraidjust be careful photo of the day from kerala fdf caefbf covid coronavirusinindia covid corona coronavirus kerala coronaoutbreak",0.117
"140","corona viruscoronavirus aft it mutate i modify none of you will be safe even it creator myabbagodandhisangelsarepissed good luckbuckle up maybe ff mark ffcffbaff ftdt eff",0.465
"141","hello justintrudeau your welcome to india tamil nadu along with mrssophie here due to the climate n heat corona patient are getting cure the study also say tat it cant survive at excuse me we tamilians love you n your family with love from india tamil nadu edaefbf",0.746
"142","me watch the world go crazy knowing this i just another test from godwe be aitefbdedaefbf",0.746
"143","cricket f corona win football eabdefbf corona win basketball f corona win hockey f corona win box ffaa corona win cinema corona win rugby f corona win school corona win college corona win corona i on fire ffa covid",0.616
"144","they are the true heros feda alessiabonari an italian nurse treat patient with coronavirus convey through a social media post that she was face a medical emergency and was afraid to go to work corona coronaoutbreak respectnurse",0.746
"145","another episode of antinationalism and intellectualjihad by bollywood since gulshan kumars death bollywood i pure and blunt hinduphobic and paint picture for abrahamic religionsec the reason why indian you i go to dog husnjihad jihad corona fakefeminism",0.27
"146","this i me do what i love in a remote sett away from corona work in flutter today on some movement logic for our ecommerce app what in your cup right nowefbfdbfdba flutterdevs corona coronavirus developerlifestyle dart",0.244
"147","this was everybodys yearebcefbf now look at u fabfbedefbfbfa smfh corona",0.125
"148","b of safety country i turkey aganist corona in the world you can come to ebaefbf coronaturkiye coronaviruesue coronawirus",0.657
"149","world fashion follow america and america i follow india namaste indianculture f by the way irish pm leovaradkar i also of indian origineccefbf coronavirus covid covid coronavirusupdate coronavirusinindia coronavirusireland corona coronaviruspandemic newindia",0.463
"150","goedemorgen follow ffbedeefbf buongiornoatutti gutenmorgen bomdia on this day fridaytheth vrijdagdedertiende please f takecare of corona and yourself blackcat hand all of u thank god, it friday fefafbdf",0.125
"151","oh i am way ahead of the game on corona new take vitamin c and chaga mushroom love you mom eaefbf",0.657
"152","follow these step to wash your hand and defeat coronavirus eccefbf covid coronaviruspandemic coronaoutbreak coronaoutbreak covid coronavirus coronavirusinindia corona defeatcovidtogether covidindia coronavirusupdate coronaalert preventionfromcovid who",0.463
"153","stay at home safe and sound my friend edaefbf covid coronavirusupdate corona",0.746
"154","a our family had to schedule our disneyworld trip for next week we recognize how ecluckyed we are to have the opportunity to do so not everyone ha that second chance to every family whose plan have been affect by this new my pray are with you edaefbf corona",0.746
"155","corona virus i teach whole world the indian way of greet namaste namastecorona you can also instead of vreeting with handshake can use namaste to greet other ebaefbf corona coronavirus coronaviruspandemic coronaoutbreak",0.657
