"","text","score"
"1189","actual true fabfbcedefbf fafbfeafebfebfeaea eaea eaea eaea eaukraine odessa corona virus covid quarantine lifestyle daily freelance workfromhome coronamemes musician life truestory meme meme ok staystrong stayhigh washyourhands",0.125
"1190","pend treat from that friend can wait corona virus wontedfb coronavirus coronaindia covidindia staysafestayhome c safehands safetyfirst covid virus safehandschallenge pend treat friend",0.309
"1191","candle light dinner with bae can wait corona wontedfb coronavirus coronaindia covidindia staysafestayhome c safehands safetyfirst covid virus safehandschallenge",0.309
"1192","nightout with besties can wait corona virus wontedfb coronavirus coronaindia covidindia staysafestayhome c safehands safetyfirst covid virus safehandschallenge bestie nightout b friend, forever",0.309
"1193","treadmill in the gym can wait corona virus wontedfb coronavirus coronaindia covidindia staysafestayhome c safehands safetyfirst covid virus safehandschallenge treadmill gym",0.309
"1194","meet that can be an email can wait corona virus wontedfb coronavirus coronaindia covidindia staysafestayhome c safehands safetyfirst covid virus safehandschallenge meet email",0.309
"1195","coronavirus doe not know racism virus ha spread tremendous please take action to avoid the virusfor this visit to find out the correct information on how to protect ourselves from coronavirus unicefvscoronavirusffc roseeccefbf rbff alphaffba",0.463
"1196","director karthick naren collaborate with malayalam writ sharfu excuse me suhas for d read more here eacefbf dhanush karthicknaren virus varathan",0.389
"1197","in this time of certainty precaution i better than prevention let come together a a community and support each other stay safe caefbf coronavirusindia virus coronavid coronavirusupdate",0.117
"1198","loveeda i like a virus it can happen to anybody at any timefe love virus",0.746
"1199","follow this guideline in order to prevent the spread of covid virus and stay safe edaefbf coronavirus coronavid coronaviruschallenge coronapocolypse washyourhands wearefightingcorona coronanews virus korea virusoutbreak novelcoronavirus",0.746
"1200","b l o c k b u s t excuse me r load director collaborate with sharfu suhas the writ of malayalam blockbuster varathan virus for d ecc",0.463
"1201","collaborate with sharfu suhas the writ of malayalam blockbuster varathan virus for d nanga varomffaedaffaf",0.746
"1202","eaaefbf announce further postponement of all itf sanction tournament due to ongoing covid until monday june",-0.066
"1203","touch something other than your face prince fafbcedfeaefbfeafebfc coronavirusffaa coronavirusupdate covid covid covid",0.289
"1204","doctor stay at work for u let stay home for them edaefbfcovid",0.746
"1205","this i the stuff we are made of edafacfabfbfab covid",0.746
"1206","i love you so much my little scientist this outfit seem fitting for this monthedaefbf you will always be my sunshine during the rainy day eefbf ites been an eyeopening couple of day a we try to accept this covidea",0.465
"1207","we are support several exist ldt protocol by provide test component and mid to highthroughput automate solute follow the link for the full list eacefbf covid covid coronavirus",0.389
"1208","stay healthy and clean thank coronavirus covid coronavirusoutbreakeaaefbf hygiene washyourhands stayhealthy jvsion jvsionad jvsionadvertising",-0.066
"1209","elsewhere ites very easy for peoplese identity to be reveal when test posit but in my own country ites a taboo how then can you fight it another case found in accra today numb move to fbdede modi mo nky m no di wai f covid",0.125
"1210","spanish flag light up the tel aviv city hall in solidarity with spain near people die in spain due to coronavirus over infect caviva espacba ffaeffbffaaffb te amamos espana y mucho edaefbf madrid madridencuarentena covid",0.746
"1211","you canet stop u covid ffceffaa those who believe are not afraid of lose faith and we have the k godof the world and he keep u from everyone a great command to be glad ye edaefbf today in ffaeffb music i a bless f corona coronavirus covid",0.746
"1212","those magical moment can happen on when we all together share the same love and respect above it all weareinthistogether edaefbfce ffaeffb beautiful coronavirusindia coronavirusnigeria coronainpakistan confinement coviduk covidsouthafrica covid convid gradient",0.746
"1213","ye this covid a crisis situate but donet be overcome in your soul your mind will emote by the whirlwind of fear circulate feed your soul in way that g it life and peace ecfbd givehopedaily hopeunleashed charlotte clt",0.463
"1214","covid day quarantine bi neighbor are stand in their window applaud cheer each other heartwarming notalone parisiens faecefbfb",0.463
"1215","join startup heal company for a webinar tomorrow thu mar pm et to learn how teledentistry can help your dental practice navigate covid challenge and beyond register here eeaefbf",0.147
"1216","safe smart and convenient for young kid family covid kid family cop holdingittogether keepgoing stayhealthy childsighttoolscae",0.279
"1217","relieve that eurovision ha been cancel and greece wont show up with that atrocious songff by the way heres an actual beautiful vintage song also name supergirledaefbf eurovision greece covid covid",0.746
"1218","we are here for you here are our source find more information on the ease a well a citywide protocol and service here eeaefbf",0.147
"1219","a mass shoutout to each and everyone who help fight the coronavirus edaefbf covid covid covidebc covid covidcanada covid covidusa usa canada",0.746
"1220","stay safe out there stay woke stay home stay clean get readyffaaedeefbf iamlegend newyork covid staysafe stayhome tlpicks beautifuldestinations beautifulhotels travelgram travelbloggerea",0.125
"1221","dis damn covid b not interfere with our summer in toronto eh just make sure yall fix up do your socialdistancing and wash your damn hand which yall shoulda been do we have fete to mash up and waistline fi ketch please stay safe yalecfbe",0.463
"1222","let take our mind off of covid for a moment and talk about clean sustain beauty duct from feaefbfbea ea the link to my late blog post feature vapour duct can be found in my bio clickea",0.657
"1223","test that new medical mask made by the blue hawaiian punch covid protectyourself cootie onlyinmemphis fafbedefbf memphis tennessee",0.125
"1224","show the live stream to putz you to can watch this discussion about archaeology and covid eeaefbf",0.147
"1225","i have been selfisolating due to my chronicillness heal condition but i am try to stay posit think of you all during these unprecedented difficult scary time stay safe twitter friend ffb coviduk covid coronavirus covid bekindtooneanother eda",0.746
"1226","nope u people would be infect ffwashyourhands edefbfcovid",0.309
"1227","ffaalgeria past from to dead person with covid eefbfeaaefbf coronavirusupdates",-0.066
"1228","clip career cae remote work thousand of people are likely to be work from home for the first time this week due to the coronavirus outbreak for other it just like any other week clipcareers cc recruit wfh covid workfromhome selfisolationgame",0.279
"1229","human of twitter please post more beautiful art tree nature picture the world need it always but especial now feafcbfbcfcbfcbfaedfeafafcbfa eeaefbf mandatory tweet to battle covid coronavirus apocalypse coronaviruschallenge coronavirusupdate covid",0.147
"1230","take a cup of ginger tea twice a day to boost your immune system excuse me if your immune system i healthy and strong no ease can attack you gingertea ayurveda ayurvedictreatment immunesystem coronavirus healthbenefits covid trendingnow precautionsforcoronavirus",0.244
"1231","check u out on grubhub postmates doordash for all of your healthy need ffddeaefbf heal healthy covid arcadia deliveryservice deliveryavailable immunesystem support healthiswealth eathealthy drinkhealthy behealthy youarewhatyoueat naturalmedicine",0.657
"1232","stan list eca covid",0.351
"1233","early today with a heavy heart we made the decision to suspend our class for the re of the current term to ensure were do everything we can to stop the spread of covid we will be offer online source to our student and family during this difficult timeedaefbf",0.746
"1234","caption this photo fight social distance boredom fabedefbfa photoffb socialdistancing covid corona immunesupport isolate captionthis dunkwall dunkwallwednesday iwanttoplayagameea",0.125
"1235","take care if covid hit ffbaffb like fbe mortal rate eaefbf italy",-0.033
"1236","open to serve you with take out eefbf coffee tea ffdb and other beverage and food fcaf openforbusiness covid coronavirus besafe thehideoutcafe hideout hideoutnewwest newwest newwestminster downtownnewwestea",0.244
"1237","stay safe ffa stay strong ff ec we will get through this together deal support",0.407
"1238","we real need to understand thiseaedaefbfea coronainpakistan coronavirusupdate covid coronavirusoutbreak",0.746
"1239","literal count paper thates how bore the been try to stay create in a uncreative circumstance be safe everyone and self quarantine if you can fbedaefbf besafe inside studio laart covidea",0.746
"1240","since im feel healthy overdue for a donate this was a great reason to leave the home momentarily if you can donate please consider and make an appoint because theyre busy or online stayhealthy donate covid coronavirus ffabffbefbfee",0.529
"1241","eaaefbfbreaking italy port a tremendous new covid case and a cord deaths since yesterday total to case deaths",-0.066
"1242","covid thank saudiarabia thank ministryofhealthksa thank the govern of ksa edaffa now this i the mean of people right the mean of feel safe and proud in my country ffbffa",0.746
"1243","just before a bunch get to k i will do this for nowffc covid okwelinda sibuttiffabedeefbf",0.125
"1244","this brought me to tearsedaefbf ffa corona italy dbdadadad italia covid",0.746
"1245","designate hospital and tact no for covid cronaviruseaaefbf covid cronainindia cronaprecatiouns delhi delhihospital helpline stopcronavirus india ekilahi delhi india",-0.066
"1246","oh boy fafbdedefbf so ites a bat virus from china chinesevirus covid",0.125
"1247","shelterinplace the gold gate bridge other landmark during our cityes shelter in place direct ffc storyeacefbf",0.389
"1248","would you just list to whos gonna save you covid stayathome dbdadadadada daddbdbdaadacdd daddbdbdaddaadacdd god bless them eda",0.746
"1249","stay home america stay home broth and sister across the world we will beat this eda covid unite state of america",0.746
"1250","take action to reduce your risk of getting sick ffbffa by share this aware video you can help form and educate the public and prevent future spread of coronavirus ecf stay healthy and tribute ffdffe corona covid aware market coronavirus multimedia",0.463
"1251","coronainpakistan covid quarantine coronavirus coronavirusupdate coronavirusindia want someone who care like corona edaefbf",0.746
"1252","when iranisalone god i always there iran will be victorious eda covid iran corona",0.746
"1253","how ironic egypt my root and the u my country take the first and second place in botch covid response i think iem the problem fabfbdedefbf",0.125
"1254","some idea for selfisolationffc eabake eapractise musiclearn an instrument therees load of tutorial eamake a silly dance routine eacuddle your dog eahome workout eacall your grandparent eaclean the house ealearn a language duolingo come through any moreeacefbf covid",0.389
"1255","love itcongratulationseaa me too i wanna rock covid i stressfulffad and this good music i the better to relax u to all next to and twistedsister yesffbffbaffb facfafaefbfafafbfaefbfabfbfafbfbfbafafbfafb isabellaincuarentena alltheworld vacuna staysafestayhome chile ffbffa",0.177
"1256","our sindh i in safe hand proud of you saiin cmsindh love you siredaefbf coronavirusinsindh covid",0.746
"1257","for our doctor support ffbffbeda",0.746
"1258","if the coronovirus kill those who cook and eat dog ah well fabfbedefbf karma get ya coronaviruschallenge coviduk covid",0.125
"1259","serbian resident under lockdown lean out window to applaud heal worker edaefbf coronavirus covid covid coronavirusoutbreak serbia belgrade beograd",0.746
"1260","wow now our town ratnagiri i also trend at well the aftereffect of detect one yo man posit for covid pray for the affectedeae",0
"1261","doctor faedeaefbfaedeaefbf nurse fa police faedefbfaedefbf airport immigrate official ffb govern staff ffaedffbcffaedffbc salute the unsungheroes of ffaeffb for their untiring effort toward combat the covid pandemic indiafightscorona ffaeffb",0.125
"1262","new belgrade give support to our medical worker covid serbia edaefbfbfbfa",0.746
"1263","ebfefbfhere keep diggingebfefbf edefbf chinaliedpeopledied chinesevirus china covid coronavirus covid fightcovid",0.309
"1264","applaudingcheeringshouting from our windowsbalconies for the heal worker during the lockeddown here in paris edaefbfabfb togetherwerise covid positivevibes",0.746
"1265","doctor faedeaefbfaedeaefbf nurse fa police faedefbfaedefbf airport immigrate official ffb govern staff ffaedffbcffaedffbc salute the unsungheroesofaefb for their untiring effort toward combat the covid pandemic indiafightscorona",0.125
"1266","i am sure will kill the covid real soon and win election again and become again ffbaffbffbaffbffbaffb president it fact ffaaffaaffadffbaffb blockchain bitcoin ethereum well done trump fcfbfaedaefbfbafb",0.746
"1267","wow one of our elder civic lead who ha weed assume seen a lot tweet this eacefbf fafbcedefbf covid",0.286
"1268","online teach ec online assess ffb lead highered institute are struggle to find answer amid the covid global crisis",0.27
"1269","if there i a stockpile of ppe then where i it and why are our essential frontline medical worker share mask protect our nhs staff eda covid coviduk covid fightcovid nhsheroes nhs",0.746
"1270","at the end of the day all you need i hope and strength feda covid staystrong keepsmiling fcbf",0.746
"1271","i have to agree with this these are unprecedented time and historic time which we should cord for future generations edaefbf covid",0.746
"1272","weere absolute love seeing all healthcare professional come together in this time to work through whates happen and share idease tongue stick out ertise from their own fieldsdepartmentstrusts etc you guy are a m a z i n g eadefbf keepingpeoplesafe nhsheroes covid",0.58
"1273","keep your spirit so high ffaeda coronavirusupdate covid lebanese motivation stayathome daeddaddadaddadadaa",0.746
"1274","a covid sweep through the u the cannabisindustry i make some interesting change fa livery service are boom eaab dispensary are develop online preorder tech fa a hemp oil sanitize i about to be lease what innovate do you think will happen",0.235
"1275","share more music on my afternoon walk alone again letes be alone together stay safe stay healthy and sing a little ebaefbfebfeb singingceo coronavirus covid",0.657
"1276","i stay at home for youecc covid",0.463
"1277","dutch healthcare minister brunobruins collapse in parliament ffaa eaefbf ukcoronavirus coronavirusuk coviduk covid londonlockdown coronavirusoutbreak covid coronavirusupdates coronavirusupdate virus",-0.033
"1278","love edaefbf virus covid love humor joke dbadbdbdbdbdbd corona humor burbulator",0.746
"1279","covid clapping for the medical staff at pm every night in france ffbe clap merci beaucoup fbefbefbefedaefbf",0.746
"1280","woh shit i getting real ffaaeaaefbf covidmx covid coronavirus",-0.066
"1281","due to the covid heal advisory the consulate can temporarily off on limit consular support passport visa and temporary travel document lpes are on issue in case of emergency please check the requirement in dutch eeaefbf",0.147
"1282","the halfcocked warn rive of lancet theory contain zero ibuprofen data but w high covid mortality data in diabetichypertensives they often get ace inhibitor or arbs so it thought thosedeacefbe the coronavirus ace target in them",0.286
"1283","just receive an email from one of my student made me smile and fill myedaefbf with ff there will be life beyond covid",0.746
"1284","i was heartbroken to learn of the loss of one of paes own in northampton county due to covid a we gather tail i must again emphasize to the people of pa to heed the warn set for by the and my full state eacefbf",0.389
"1285","sure every selfish fuck who i panic buy ha panic bought what they need to by now shop are sell out daily i it just the same cunt buy more stuff fabfbedefbf panicbuying covid",0.125
"1286","fightcovid nobody know difference btwn common cough and covid anymorefbedefbf stayathomechallenge coronavirusnigeria",0.125
"1287","letes see how this goesgot to keep go and stay posit on way to get through this edaefbfnewroutines selfisolation productive adapt covid",0.746
"1288","ffbffa saudi arabia covid hour crease pattern eaefbfbfa total case hr crease see below for gcc country ffbffb turkey i show a similar pattern with high numb",-0.066
"1289","me minime do some yoga breath exercise get rid of the anxiety edaefbf coronaanxiety covid breath relax homewithkids homeschooling",0.746
"1290","please support your local dependent own and operate business a much a you can right now edaefbf shoplocal miltonon covid",0.746
"1291","for everyone in their first workfromhome week welcome ffbbregular work efbfcomunication ffabentertainment ffaamental heal covid",0
"1292","nows the time edaefbf wevsme covid covid coviduk coronaviruschallenge coronavirus covid covidindia coronavirusoutbreak coronavirusupdate",0.746
"1293","this eacefbf please take a look covid",0.389
"1294","weeksafter fb if you have been infect with the covid then eaaefbf two week aft your worst symptom have passe you are still able to pass on the virus on to other covid be safe stay safe practice healthyhabits weeksafter",-0.066
"1295","final covid thought for day stayfawhenever possible pop out to your yard if u have one for a bit of eefbf take a social distant ffab stroll around the block avoid ffaab touch your face wash ffabc your hand often infect ffabd frequent touch surface often",0.465
"1296","i think the world ha gone fuck mad edaefbf corviduk coronaviruschallenge covid selfisolation ffaacffaffaacffa",0.746
"1297","uhohana president david lassner update the uh community on online livery facility and other change relate to covid eeaefbf",0.147
"1298","quarantine with kid have any tip to share with other parent we want to hear them follow u on instagram to submit your quarantinetip to our ig story eeaefbf visit",0.147
"1299","hope to see more about flight attendents pilot airline worker and airport staff include in the conversation around people essential to our current covid reality these brave people serve our respect and gratitude ecefbf",0.415
"1300","i getting me through covid isolate take care of your mental heal with the ninenine eda",0.746
"1301","are people actual punt on the dog fafbcedefbf covid",0.125
"1302","alertedefbf heres a full breakdown of president cyril ramaphosas address heres what you need to know coronavirussa coronavirusupdates covid",0.1
"1303","agree with everyone edefbf pandemic cover ha to be generic by it nature to exclude a particular type of virus strain must be legal incorrect plus my understand i that this i relate to the original sars virus group and ha also got a sars name a well a covid",0.309
"1304","if i survive covid a month and a half back so can you all use proper precaution but donet blow it out of portion elder stay shelter and away from those below year of age of course wash your hand hour and use your sleeve to coughsneeze simplefabfbedefbf",0.125
"1305","share this this i fdbefdbcfdbffdbcfdbbfdaefdfdbfdbffdfd fdafdaefdfdbfdbfdbbfd fdfdbcfdfdbfdbfdfadfdfb this i why young people must care it not just your parent at risk young people are dye too wash your hand stay home protect yourselves and familyedaefbfbc covid staysafestayhome",0.746
"1306","come together to fight covid not peoplecefbfb",0.463
"1307","why i my twitter feed fill with people insist on the semantic of call covid chinesevirus when theres all this shit go on ffaaedeefbf",0.125
"1308","liar cnn information kag it the third rd cnn lie during coronavirus this hurt americans information i so harmful why doe hate it own peopleed cnns goal was to destroy the stockmarket congratulate cnn",0.068
"1309","gymlyfecae i up and live we will be posit a live stream workout for at home fitness during the corona outbreak covid fitbody fitnessmotivation college state texas",0.279
"1310","update find the late information about village operate park gram cancellation senior service and more in our late covid update eeaefbf",0.147
"1311","so tell me should doctor go to school or just get their degree off facebook you probably also think this covid virus i a conspiracy ffabedeefbf the on people that talk shit about ecuselessed degree are either people who havenet gotten a high educate or art student",0.125
"1312","false online messagesposts ecuniversity of vienna memo because it ha been discover that it crease the speed of production of the coronavirus covid in the body and this i the reason why people in italy have reach the current bad stage and rapid spread",0.407
"1313","it i not a war war imply a human foe trump weird rant send a horrid msg the world not just the u will struggle wcovidffaa the u i part of a worldwide community of ally nation we cannot allow craven isolationist xenophobe nationalist to reign hereffaecc",0.463
"1314","i wonder how betty white i do during this covid outbreak be safe queen fecfbe",0.463
"1315","love how our true key worker were reveal this even not the bank no not the trade no our real key worker are the nurse doctor car supermarket staff teach livery drive porter those on the front line in our covid pandemic to you thank you ebaefbf",0.657
"1316","yall member these time covid ffadffadeaefbf",0.657
"1317","eaaefbf econline educate in the time of covided",0.177
"1318","to all healthprocae heritage professional a note from our ceo concerning covid",0.279
"1319","fromea eaaefbf local audition for s summer production of the sound of music have been postpone until further notice due to covid and to help reduce the spread of the virus we willea",-0.066
"1320","if youre planning to buy any music on wait today i learn friday bandcamp arenet talk a venue cut of artiste sale on friday make sure you make the most of it by commend other artist a well a your own lease edaefbf",0.746
"1321","our airport in lebanon rafic harriri airport i official close please stay safe everyone feda covid covid dbdadadad",0.746
"1322","we decree stand prophetical on the basis of the finish work of christ that the power of covid i hereby broken we receive wisdom and cover for our love one lead and the nation of the world in jesus name ebaafeecilorin ecwa oasisofexcellence",0.125
"1323","this i a great source from beat clear and informative eca",0.351
"1324","earth will be a better place edaefbf coronavirusoutbreak coronavirus covid covid",0.746
"1325","shout to yall our medical and heal practitioner all over the country we value youeda covid coronavirusupdate coronavirusnigeria coronavirus",0.746
"1326","with employ inevitably dry up over the come months why not take this opportunity to tact u and seek some support with your job search fadfedefbf grad graduate covid covid boris i university job jobsearch job jobinterview cession",0.125
"1327","fab the numb of children you and adult not attend school or university because of covid i soar eeaefbf learn more about late update and unescos support here",0.147
"1328","dont travel stay at the home corona virus i serious than that we thought eacefbf coronavirusoutbreak covid lk",0.389
"1329","yolod takin the chance to see aunty lorna for the last time in a whilethe gold bay heal cent will close it door to visitor a of tmrw no hug or kissesa gap between u but still great to talk and say eda you it may be a few months before we talk again covid",0.746
"1330","since corona donet want u to go to the gym fafbfedefbf covid covid",0.125
"1331","here are some of the update you need to know about coronavirus coronavirus coronavirusoutbreakeaaefbf covid covid covid nigerianmum nigeriannews",-0.066
"1332","i might forget to carry my wallet but never miss to carry hand sanitizerebefbf corona covid",-0.522
"1333","planning it b today because tomorrow i never promise drink a cup of eefbf if you no get drink water cl heal i weal morningroutine lifestyle blessednija covid",0.244
"1334","shout out to all the doctor the nurse the cashier the help around the world who are give it all to keep u safe thank you edaefbf they stay for u so let stay at home for them covid coronavirus covid covid",0.746
"1335","wuhanshake footshake foottap eadaebcaebeaeaeaf ebeadeaefefebaeb covid donet shake hand fdeaefbfd",0.657
"1336","the are advise people to follow f simple step to help prevent the spread of covid ffabc wash your hand fafb coughsneeze to your elbow edc donet touch your face ffab stay more than ft m away from other fa stay home if you feel sick socialdistanacing covid",0.271
"1337","the hunger virusffb kill about childrenffb a day and the vaccine for it exist it call foodffdc but you wont hear that in the mediaffeefbf eeaefbfdo you know why because hunger doesnt kill the richffa covid covidindia valimai",0.147
"1338","ffaa freebet ffaa icehockey f belarusextraleague russianmhl time in hour odd amount place eur stay safe everyone also let get some come during these day ffaaeda sportspicks prediction tipster sportsbet covid",0.746
"1339","wish i had my own petroleum aj mai achi sale kartaebbdefbf ps normal day hartal curfew khanyar covid",0.152
