"","text","score"
"460","your saturdaylimerick therees now a virus cause lot of fear and no paper to clean up your rear weell soon fill up the roll god always in control all this cause of bad mexican bee fabfbdedefbf lordchiefrocka coronavirusupdates coronavirus toiletpaper covidebc covid",0.125
"461","question aft day of selfisolating and we all come out of our home what happen then will we catch it or ha it gone ffabedeefbf coronavirus covid coronaoutbreak coronauk",0.125
"462","stay informedfbe stay safeec covid",0.407
"463","stay form and plan ahead for more information on impact program and facility in toronto during covid eeaefbf",0.147
"464","it saturday ffba come and enjoy your cafecito outdoor hand sanitize i free ffabc cafecitotime covcbd outdoorslife space coffeetogo coffeetimee ollae tongue stick out resscafe atripineverysip satx mexicoinsanantonio",0.244
"465","donnie i not happy about covid mess with hi chance of getting elect ebefbfcan you please do me a huge favor and consider buy me a cup of coffee if my tweet made you laugh you can do it hereff",0.209
"466","apology accidental link and tweet an account that pretend to be but clear isnet one by tony fauci niaid tweet delete fafbdedefbf covid",0.125
"467","i just went to watch f practice qualify and it cancelled because a member of mclaren test posit for covidebc covid and im shock but also hope everyone i well fadfafefe eda formulaone formula fcancelled",0.746
"468","if you are a delaware resident and have question about covid or source avail for you and your family i here to help call email or visit their website tail below eacefbf",0.389
"469","found out yesterday my toddle daycare will be close for the next three week fbfbcfdbfdbfdb who else i affect by closure and how are you planning to manage it edaefbf covid ontario toddlerlife momlife help sendbooze",0.746
"470","the point bee made obama swine flu die and small children die and young were hospitalize and no mass media ever compare to covid the total usa elder in washington st elder have sick heal edefbf this mass hysteria deepstate",0.1
"471","there are now case of covid excuse me also known a coronavirus excuse me in north carolina use the s new interact map to stay up to date on where the case are across the state eeaefbf",0.147
"472","how are you guy hold up with a lockdown social distance in place how are you feel about everything com below and we can all commiserate edaefbf check out my file for a post on how to talk to your kid about covid include boredom bustea",0.746
"473","the church i go to cancelled service tomorrow because of covid hallelujah thank god ecfb",0.463
"474","please use this link a the previous link i broken efa",0.111
"475","china probably deal with nd wave of covid eaaefbf coronavirus ainet over till ites over",-0.066
"476","hey fellow coloradans it beautiful outside drive in your car to the high country alone for a hike fresh air i better for your immune system than lay on the couch eat frozen pizza the tree rock view dont have covid and there are no people close to youeda",0.746
"477","all of this covid new i scary but romana read ecif god i for u who can be against use find peace in him during these time donet forget to be patient and kind to other jehovah shalomedaefbf",0.746
"478","service a normal tomorrow amfafebaefbf excuse me tongue stick out lains our preparation heal concerns",0.125
"479","qucadateencasa covid coronavirus fafa fa fbfbrepost with makerepost ebbebbebb believe timesarechanging fbfcfbfafbfafbfaefbfbedefbfedfb",0.309
"480","we are frequent update our website to include the late information and directive from in regard to covid you can learn more eacefbf",0.389
"481","service a normal tomorrow am am pmfafebaefbf excuse me tongue stick out lains our preparation heal concerns",0.125
"482","that heat should be an adequate step in eliminate covidand a cup of jb eefbf",0.244
"483","important covid update for rrcc studentsebcefbf eeaefbf while there will be no class during this timeframe administrator faculty and staff will spend that week excuse me tongue stick out loring alternate mode of livery and adjust campus learn space to ensure the safety of our community",0.147
"484","pray up for your broth and your family i just read an article from m i i think that port extubating and charge covid patient so there i hope keep the faith fbcedaefbf",0.746
"485","teach this link i in italian but it ha a great english pdf amongst many other language with a little workbook aim to ease anxiety kid may be feel surround covid great source to help our kiddo ffdeda",0.746
"486","thank you for the quest to suspend student assessment among covid fbcfbcfbc edaefbf all sc teach",0.746
"487","seem like china will be the new superpower now aft their corona virus stuntfafbedefbf covid covidebc",0.125
"488","national guard i bee sent to sou florida this week for mass test a ites been identify for community spread of covid i wonder why fbcfafafbedefbf",0.125
"489","this social distance the i gonna turn a pandemic to a echandemiced ecafbcfa socialdistancing pandemic covid",0.429
"490","homeoffice niet kunnen v niet willen big difference think on it fast care about your people edaefbf they make your busy especial if theyere healthy covid",0.746
"491","catch up and follow our late coverage of the coronaviruspandemic on our youtube channel eeaefbf",0.147
"492","many of u have been selfisolating since feb so let help out those new isolate folk ffb with stuff to do here i what im do this wkend purge my bookshelves of all my preretired work relate read sing my computer file folder ffabedeefbfeefbf whattodocovid covid",0.465
"493","please just change your holiday date eda savetourism covid",0.746
"494","because of recent cdc commendation regard covid our absurd salon schedule for march th ha been postpone stay tun for update on further cancellationsdecisions concerning covid for now all you darling and lovely stay safe and keep writ poem eca",0.351
"495","send a thank you to nurse doctor hospitalstaff during covid was complete awe by my medical teames calm grace during a noncovid issue this weekend their bravery i truly admire sure we can social isolate to keep hospital and neighbor safe edaefbf",0.746
"496","corona virus i maybe a wake up call for u to make tawbah and turn back to allch swt ffeda covid",0.746
"497","it was hard anyone in there theyeve move all condiment from the table place them with plastic utensilsffa ffdbno joke everythinges weird now the world ha become a ghost town ffbb appleffdebeescaeefbf ffb covid",0.279
"498","ha a solute for that just search for whatever your favorite type of workout i and for now my second time since covid i edaefbf and both great noequipment option",0.746
"499","ye sirheeding to the directive of heal guideline and putt them to use i key to get rid of covid properhandwashingebsafety",0.209
"500","just back from my local toilet paper pasta rice store eacefbf the bastard even gorge on the biodegrade bin bag f covid",0.389
"501","if you have no symptom and youere able to go to the shop please go to the shop and leave online order slot for the elder and vulnerable edaefbf covid",0.746
"502","socialdistancingnow socialdistance eeaefbf takeout and livery for restaurant coronavirus covid coronavirusupdates",0.147
"503","ffa communicate coronavirus advice to the public without excess science jargon ffaaffaffabedeefbf easily get lost in translate fusion ffabedeefbf ffaefbfsay what on the tin clarityffaefbf ffaabheinz bake beansffaab coronavirus nhs coronavirusuk pheuk nhscomms covid",0.125
"504","people of kosovo have shown their gratitude to heal personnel on the coronavirus frontline by applaud from their window edaefbf thank you fb covid",0.746
"505","very serious question what are yall do about haircut fedefbfa covid",0.125
"506","ok yeg the need your help more than ever bc of covid they have had to cancel the dinner group that come in to prepare the meal for the family consider donate support those little one their family eda",0.746
"507","late covid campus update include new tail on campus mail and s plan for temporary turn schedule this week eea",0.147
"508","ffcbe mind again these are simple step to protect yourself and other from covid coronavirus camaichardwho",0.117
"509","eaaefbf in response to covid all wellingtoncountylibrary branch and the wcma wellington county museum and archive will be close to the public march excuse me april tail",-0.066
"510","when your build i close for covid concerns so you cant access the podcast room to cord your audio package you make do with the next b the ffabedeefbf",0.125
"511","ffaacoronavirus update worldwide people are infect have die are in critical condition have cover from lightmild form of the covid in the usa are infect americans have die are in critical condition have recoveredeaaefbf",-0.066
"512","the brightside with covid i that we will all be passe our final with fly color eca",0.351
"513","iem an epidemiologist and ieve been wait for this moment fabfbedefbf in all serious though very interesting read covidebcuk",0.125
"514","ecamerican people are so immature theyere all out in public and not on lockdown like all these other civilize countriesed no we just donet care laugh my ass off me you and everybody else i gonna die one day and you canet stop it go live your life if covid get me then oh well fabfbcedefbf",0.125
"515","you are a guardian angel in scrub thank you so much for all you and your colleague in the covid war zone are do to save u we will never forget edaefbf",0.746
"516","east end of glasgow ha a few confirm case of covid in school donet send the kid to school sell isolate i need b it get to most and the vulnerable in your live fabfbedefbf",0.125
"517","ye camden love people join the covid mutual aid group already and every ward ha a whatsapp group now go brilliant work and pritam singh act of community love eefbf letsjoinin",0.465
"518","controversial opine alert ffaa brexit should be halt until the whole covid pandemic i over so the uk gov can fully focus on the uk getting out the other side in not too horrific a state fabfbedefbf covidebcuk brexit",0.125
"519","ffaaffaa hi all edaefbf we are keep a close eye on whates go on with covid a of now we will be open for class a schedule the hiit class for the week have been modify so that you will have your own homeea",0.746
"520","since friday i have receive email pertain to covid each one more escalate than the previous am i miss something anyway dont forget to wash your handswith soap and waterfor at least sec ecc",0.463
"521","iem a lyft drive and have been drive to support myself while i find a new dev role due to the virus pandemic i am on make hr i am in seattle and have test posit for covid any monetary support would be appreciate fbedaefbfb venmoe covidebc lyft",0.746
"522","there i no evidence current that dog have infect human with covid so good doggos around boston are help out any way they can edaefbf",0.746
"523","a the covid situate escalate we have taken the extra precautionary measure of definite close our official store and office a from monday th march all usual line of communicate will remain open ebefbf",0.209
"524","i hope no one i getting their covid new from complex fafbedefbf",0.125
"525","my kid out deliver meal made by friend to folk in foodbev industry out of work since coronavirus g zes to rescue fcfbedaefbfbafb",0.746
"526","lionshead i on fire ffaffcbffathe same way we can extinguish the flame speedily we can all combat this catastrophic world war pandemic together signalhill thankyou firefight thankyou coronafighters flattenthecurve coronavirus hope world peace southafrica ecefbfce",0.463
"527","ok iem go to put this one out there i man flu more or less severe than coronavirus ask for a friendfabfbcedefbf ffaadffb",0.125
"528","cut rate to zero and announce bn qe programme amid coronavirusafflicted market co eeaefbf",0.147
"529","i predict this with a post on linkedin yesterday but the potus was surprise when it happen today ffs fafbedefbf coronavirus prediction economiccrisis i genuine fuse to believe i knew it would happen before",0.125
"530","our elder cord an entire service with all the element of worship so our community group got together ate norwegian pancake ecafbc and other potluck goody and worship together eaea close all nycschools",0.429
"531","sou africafalse ec category are work covid",0.407
"532","new sou walesfalse should do this now b st patrickes day crease covid case all over indiana covid trumpdemic tzgemunited statesfalse coronavirus i seriousplease take percautionswash your handskeep skin to skin tact a minimal a possibilestay at home to protect yourself and also for people who are in risky place than youwe will overcome covid inshaalah eda",0.746
"533","need to excuse me tongue stick out lain to me how ffaffb ha a bfadfbedefbfand k case but ffbaffb with m fadfbedefbfhas m case",0.125
"534","the late ortholeakscae i out from abraham blacksmith",0.279
"535","homework this week ec include another lesson on importance of hand wash easterhomework homemade covid",0.407
"536","what we realise in time like this i how amaze family are meal prepped for hour call nerve a little more elevate than usual but my mum who ha h own heal issue to worry about take time for me letes not take each other for grant edaefbf mums covid ireland",0.746
"537","all my love plz stayathome protect urself not get the virus ites also the safety of your parent grandparent who r in a risky place than u i love u all iem sure that we will overcome covid look forward a better tomorrow stay safetake careu r so preciousedaefbf",0.746
"538","eeaefbf find confirm that covid i spread simply through breath even wout cough it seem likely that tact with contaminate surface i a primary mean of spread dont forget about hand wash but if you dont want to get infect you cant be in crowdsed",0.147
"539","eeaefbf breakdown of case about of those who tract covid on get mild ill get hospitalill critical ill the mortality rate seem to be between but that need to be adjust for age mortality i over and drop low for young cohort",0.147
"540","eeaefbf covid likely originate in bat those share rumor that covid came from chinese people eat them search now believe it went from bat to another animal specie before jump to human and that fecaloral transmission was the likely vector wash your hand",0.147
"541","eeaefbf there are no real treatment for covid yet remdesvir ha shown sign of reduce mortality but it i in still in test i in short supply and on avail under restriction steroid a common treatment for respiratory ill may make the worse",0.147
"542","fagresive social distance nowffaa we all need to do this now takeaway from the ucsf covid town hall this week eeaefbf if youere excuse me tongue stick out osed to covid youere likely to see symptom in about day with median of day",0.147
"543","covid covidebc coronavirusffaabffaaffaac pandemic prepared nationalemergency stateofhealtheca gov pritzker announce closure of all illinois bar and restaurant effect monday due to coronavirus crisis excuse me cbs chicago",0.351
"544","covid coronavirusffaabffaaffaac nationalemergency pandemic prepared stateofhealtheca governor newsom order all bar and nightclub in ca to close restaurant can operate at percent capacity",0.351
"545","socialmedia i the pandemic gonna cause a temporary surge in vlogging i say ye ffceccefbf",0.463
"546","god please g me strength to deal with this coronavirus that i go on right now fbfbdedaefbf staysafe washyourhands",0.746
"547","love in the time of coronavirus edaefbf",0.746
"548","ye dont forget to thank the cashier and employee at the grocery store they are on the front lineseda covidebc coronavirus toiletpaperwars",0.746
"549","get well soon edaefbfcoronavirus weareallinthistogether boristhebutcher gtto onlyonejeremycorbyn",0.746
"550","coronavirus or not shouldnet people still be wash their hand and cover their mouth when coughsneeze anyway fabfbedefbf",0.125
"551","well herees the outcome of my selfisolation a song about social distance ff do your part edaefbf coronavirus covid socialdistancingnow",0.746
"552","eeaefbf now on",0.147
"553","it need to be said no negate comment this i a state not a bate please share your story below fedaefbf tipping help each otherespecially now in this crazy",0.746
"554","this i not an easy decision to take but due to covid ieve decide to put just board on hold and stop organising trip until the situate improve ites the b the to do to stop spread the virus take care and ill see you hopeful soon for new adventure edaefbf",0.746
"555","people real out here hoard food like willsmith in i am legend fafbedefbf coronavirus covid pandemic panic",0.125
"556","spend time a positive a we can sad already people have passe away here in ffaffb we are go to a complete lockdown for a few weeksff send hope people all over the word so grateful for those in first lineedacovid pandemic",0.746
"557","stayathome staysafe it s the easy way to protectourlovedones eda covid pandemic",0.746
"558","ffanewyork andrew cuomo mayor bill de blasio calingefbf safety doesnt work alone close the ny school there i a coronavirus pandemicffb",0
"559","note to jefferies client priority strategy emote in a pandemic peoplefirst newreality leadership thisisbig worldhaschanged volatility unitedwestand marathon governmentaction thisispersonal jef eeaefbf",0.147
"560","i use to eat my feel this whole pandemic i a real test of will power grateful i have my diabetic ass under control i donet know how i would have handle this mths ago be well my friend edaefbfu all we will overcome this we will be strong and wise diabeticlife",0.746
"561","for all those caregiver out there who are look out for u highriskcovid folk my boo wrote about what thats like during the covidebc pandemic were all in this together scar edaefbf spoonies chronicillness chronicpain coronavirus",0.746
"562","thates not social distance fbcedefbf hahah look at how human have become self centred these are the kind of people that are likely to spread the virus ff panicbuying pandemic coronapocolypse coronavirus",0.125
"563","all these suppose covidebc wuhan virus flu commoncold eaefbf deaths i have yet to ff see a eabefbf funeral",-0.033
"564","coronavirus evil virus cartoon character with stop sign vector illustrate isolate on white sign ca bluedarkart thechameleonart ff",0.117
"565","ca eefbffalse covidebc i help u see the global picture for the sake of so many other reason",0.465
"566","false ites been almost a week me and wife are work from home due to corona virus ffaa situate i think we will kill each other before the virus doe workfromhome virustzsamooryusa florida eccefbffalse thank virus highriskcovid tzrichardgeoghegfalse bake good",0.463
"567","actual all you need to do was follow basic hygiene protocol that you should have learn when you were but keep blame the covid virus a worldwide pandemic with a recovery rate on trump if it make you feel betterffaaedeefbf",0.125
"568","unreal juanguaidcb i go to proliferate a pandemic in venezuela fafbedefbf",0.125
"569","ecinconsistent use of goggle gown glove cap was associate with a high risk for sars infectionededefbflet all healthcare worker be well protect so that they do not infect themselves of any virus fbd sufficient medicalequipment train also help doctor nurse",0.1
"570","a we know virus evolveguess it time to upgrade the vehicle to emad maxe specify fabedefbfafa covidebc covidebcuk coronavirusupdates coronavirus whereisboris branson patient covidupdate madmax virus",0.125
"571","i m not the on one who i wait to see the swag of our stylish cop ffaffasooryavanshi got postpone but not our excite nd no virus can stop u to love you paaji eaefbf soon in theatres aya policeffaffa",0.657
"572","ffceaa see how fast covid spread ffbffbffbff covidebc coronakrise coviddeutschland covidde corona coronavirusoutbreak italien irancovidtruth irancorona iran virus",-0.066
"573","i think we can achieve world peace if we spread this info shirt link below edaefbf",0.746
"574","ff we have a situate where satan will not win because many people are help other people edaefbf ffad ff ffa ffb ffaa ffc we are show care and love we are go to get better this ffd situate will come to pass ffad thankyou thank coronavirus plantbased virus satan ffad",0.746
"575","eaa we are now again in extraordinary time the top priority for u i the nurse staff doctor they will make history your service are priceless ffcadd a heart to itffc ffbffaffcffthank youfcfafb covidde covidebc corona who virus corona",-0.066
"576","lockdown ffhow the change coronavirus china edaefbf pandemic panicbuying virus toiletpaper viral london unite kingdom",0.746
"577","pni empower train for everybody what you need to know to boost your immunesystem use psychoneuroimmunology pni edaefbfebefbf selfhealing selfhelp aware mindful mindbody medicine immunity ill virus cancer heal technique coronavirus covid",0.746
"578","sup sunday bardbits prompt virustransmissionairborne and adamanthearts over starsdelayed write a short story or poem inspired by or use the word andor image photo credit jmb combo prompt are welcome fafaedefbfafceaefbfc",0.125
"579","my teddy i hide from the scary virus teddybear teddy mycat catsofinstagram scaredycat virus edaefbf",0.746
"580","it seem like the rebel stole the plan again eaaffa get them back i member when my deathstar look like the new coronavirus covidebc covid starwars virus pandemic highriskcovid",0.177
"581","yall worry about toilet paper just get a bidet problem solve fabfbedefbf work smart not hard convid convid convidvirus virus healthliving ffaaffb thastevoshow youalreadyknow vlog youtuber instagramea",0.125
"582","biden sand face off tonight in bate overshadow by virus tail eacefbf",0.389
"583","many of u will be told to work from home in the come day and week if youre new to homework and want a little help planning your routine take a look at our tip below eacefbf",0.389
"584","donet panic troop plenty fresh air up here and i sure to be a virus kill get out and do your the keep calm and enjoy your sunday fadfafabedefbfabedefbfa",0.125
"585","ffbbremember that the beginning of this video i aboutfrom event a highlevel pandemic exercise simulate on october in new york nyffba fantastic videoedefbf virus",0.1
"586","i mean self isolate for me i just perfection anyway but if i had a dog i mean come onffbedaefbf ea ea ea covid coronavirus isolate givemeadog covid corona virus meme foofighters timeslikethese",0.746
"587","the current uk gov who i lead essentially by dominiccummings the man who wrote a book in state that a virus with mortality rate of should be allow to propagate through then uk to move ececonomically inactiveed member of society tire and disable ffaffb eaefbf",-0.033
"588","i so miss travel ecefbf corona be safe everyoneavoid travelling a much a you can corona virus besafe precaution care covcbd safe quarantine rj",0.415
"589","pray for the world theres a sunrise and a sunset every single day and theyre absolute free dont miss them everyday i an opportunity to set and this virus will pass through too eca",0.351
"590","cure for coronavirus with result good old vitaminc high dosage pair lung and beat the virus pneumonia respiratory fafedaefbf",0.746
"591","the pandemic sky chicagoskyline just beyond the old railroad bridge which i now a pedestrianbridge off of clybourneavenue just east of the riv faedefbfea chicago railway traintracks bridge chicagobridges trainbridges searstower willistower",0.125
"592","this just in ffceffceffceffceffceffceffceffceffceffceffceffce fafafafafafafafafafafafaf moderate dems do not win ffb presidential election especial when theyell veto edcmedicareall during a pandemic ffaabffaabffaabffaabffaabffaabffaabffaabffaabffaabffaabffaab ffaaffaaffaaffaaffaaffaaffaaffaaffaaffaaffaaffaa who can beat trump",0.271
"593","ffa we wont forgetff corrupttrump corruptgop still cutting snap benefit effect school lunch etc on april regardless of pandemic the least they could do i wait months to push it through ffaheartless shameful resistance ecc voteblue",0.463
"594","ffi am very sorry abt loss of your resident i edavirginia i have family tie to the state more since cornyn think this pandemic i a joke it isnt heres a tutorial for him in the graphs below",0.746
"595","im wish all affect with convid safe recovery send love to all that lost a beloved to this pandemic and god protection over our heal worker to the football faithful i miss our round leather game safe recovery italians edaefbf",0.746
"596","saw this just now and would be great on weak i that not all the elder can get out of their home but some kind of process i require who worldhealthorganization pandemic coronavirus covid eaeefbf",0
"597","ffaaffbeeaefbf monday march coronavirus covid",0.147
"598","eaaefbfthe late guidance from the commend for individual to refrain from attend event of people or more for week and that these event either be cancelled or postpone this i an effort to crease social distance marcoisland covid bettertogether",-0.066
"599","important blog from for voluntary organisations work in criminaljustice on the late guidance and information from hmpps about coviduk please share eeaefbf",0.147
"600","scientist at in partnership with virology team have sequence their first genome of covid this kind of information i crucial for track the virus and investigate it spread read more eacefbf",0.389
"601","i wonet be surprise if trump tweet this fafbdedefbfcovid covid",0.125
"602","the u department of defense dod on march announce new domestic travel restriction for service member and civilian personnel in response to the ongoing covid outbreak read more on shephardnews eeaefbf",0.147
